Unnamed: 0,rating,title,text,topic
533,5.0,Easy to use!,"Easy to use, all products came to help easy of use.",Beginner Friendly Use
534,5.0,Good quality product,"Good quality, everything as advertised and the eyebrow tattoo pen works perfectly.<br />Super fast shipping!",Complete Brow Kit
535,2.0,Not That Great,This product does not create ‘hair like’ strokes. Not what I thought.,Complete Brow Kit
536,5.0,Product is very natural looking and lasts thru the day without smearing...,"Product is very natural looking and does not smear or rub off throughout the day. I was also pleasantly surprised to find that my order came with some bonus items too....tweezers, & another eyebrow shaping accessory. That was nice to receive as well. Good product.",Complete Brow Kit
537,5.0,Great buy,Got this for my mom and she loves it,Value for Money
538,5.0,live it,"this is very good eyebrow tatoo pen. It last all day, it's easy to use. I recommend it for all",Complete Brow Kit
539,5.0,Glad I found this product,"Very easy to use, does not smear and looks natural.  Will definitely buy again.",Complete Brow Kit
540,5.0,Great eyebrow tool,"I use the pen to fill in my sparse eyebrows.  I did not use as directed, just used to fill in solid color.  Works great and stays on all day even through workouts.",Complete Brow Kit
541,5.0,Would purchase again.,Love the ease of use except for the stencils.,Beginner Friendly Use
542,5.0,Quick and easy!,Simple to use. Takes a little practice. The templates help.,Beginner Friendly Use
543,5.0,Loved this brow pen!,Very good!,Complete Brow Kit
544,5.0,Product as described.,Easy to use and stays on all day. My,Complete Brow Kit
545,2.0,save your money.,This was one of the WORST products I've ever used.  It never seemed to work.  It seemed the pen was dried out. What a let down.,Product Drying Out
546,1.0,Bad,Really bad,Application Difficulties
547,3.0,Eyebrow,The only thing I didn't like is the color,Complete Brow Kit
548,5.0,Perfect brows!,Love it! Easy to use and last long.,Complete Brow Kit
549,5.0,love it,perfect for me,Value for Money
550,5.0,Stays in place!,I love this product. I finally found an eyebrow pen that stays in place and doesn’t wear off.  I enjoy having the stencils as well. The color is a tiny bit dark for me but I think it was my best option.,Complete Brow Kit
551,5.0,Super easy,This was super easy to use!  Love the look!,Beginner Friendly Use
552,5.0,Worth the money,Easy to use and looked natural,Beginner Friendly Use
553,5.0,Great product!,This is an amazing product! Highly recommend!,Product Dryness Issues
554,5.0,Natural looking brows,This is the second pen I purchased. It is very easy to use and looks natural. Love that it came with some nice extras. I will definitely purchase again when this one runs out!,Complete Brow Kit
555,1.0,Bad product,Does not work. Dried out in one day.,Product Drying Out
556,5.0,Good pen,This product works great!,Complete Brow Kit
557,5.0,Great,Looks just like real hair strokes . I got the brown which blended really nice . Definitely recommend this product,Complete Brow Kit
558,5.0,I will buy again,I love this it have everything in the package and it stay on for a least 4 days,Complete Brow Kit
559,5.0,Great product,Works well as advertised.,Value for Money
560,5.0,⭐️⭐️⭐️⭐️⭐️,Good product,Value for Money
561,5.0,Awesome product,Lasts all day,Long Lasting Wear
562,5.0,Works great,"works great, stays on, easy to use, inexpensive",Long Lasting Wear
563,1.0,Not happy,It didn’t last 3 days so the temporary tattoo hook is bogus,Product Drying Out
564,5.0,Very easy to use.,"Dark brown/chestnut is a great color, not reddish.",Beginner Friendly Use
565,5.0,The BEST product out there to improve the look of your Brows...,"I had my eyebrows done with permanent make up 10 years ago. The semi permanent ink is fading! My eyebrow hair is slowly going away or falling out. I have tried 9 products to improve the look of my eye brows. ""Nothing worked.""<br />This product is the ""BEST"". It worked!! I have almost perfect eyebrows now.<br />Thank you Thank you...<br />Mimie",Complete Brow Kit
566,5.0,Awesome!,"Great product, we also got a eyebrow clipper, shaper, and razor...in pink! Thanks!",Complete Brow Kit
567,5.0,Great item,"Love it , really enhances my brows and makes them so much fuller",Complete Brow Kit
568,5.0,The price,"This product is excellent, and not expensive at all",Value for Money
569,5.0,Wow ! I love it !,Very pleased with this product ! It did it’s job and then some ! Compliments galore!!!! Definitely a five starter!!!,Complete Brow Kit
570,5.0,Great Product,I was completely shocked when I rec'd this product. It came with all of these other things that I did not expect. I absolutely love the pencil. It glides on easily and the color looks fantastic on me. I definitely will be re-order this product in the future.,Complete Brow Kit
571,5.0,Easy to use,"This was so easy to put on, and to take off. I just bought a new one because I loved it so much!! Totally recommend!",Beginner Friendly Use
572,5.0,Highly recommended,This product worked really well. I liked the eyebrow shape maker and twizer that came along too.,Complete Brow Kit
573,5.0,Great buy,This product is amazing!! It’s actually works.,Complete Brow Kit
574,1.0,Not worth it.,"The pigment doesn’t stay in the tip of the marker. I kept having to turn it upside down and try to push the color down. It didn’t last, and totally wasn’t worth it. I bought multiple colors and ended up just throwing them away.",Color Accuracy Concerns
575,5.0,Love this product!,"Easy to use, does exactly what it says.",Beginner Friendly Use
576,5.0,Easy to use,"This was so easy to put on, and to take off. I just bought a new one because I loved it so much!! Totally recommend!",Beginner Friendly Use
577,5.0,So amazing!,5 out of 5 I love this stuff!,Complete Brow Kit
578,5.0,Great for amateurs like myself,"This inexpensive product works great for beginners.<br />The stencils makes it easy for the design you want on your brows, I would definitely recommend this product.",Complete Brow Kit
579,2.0,Not great,"I like that it came with tweezers and the razor, but that's all i cared for. The pen itseld is no good.",Complete Brow Kit
580,5.0,Have to buy.,This product is AMAZING to start off. It does not smudge. Great quality. The color is so natural and not so much of harsh ink. Well buy again.,Complete Brow Kit
581,5.0,Amazing!,Worth every penny!,Complete Brow Kit
582,5.0,It’s good,I like it,Value for Money
583,4.0,"Tough to use at first, but good eyebrow pen","Pretty easy to use once you get the hang of it, but at the same time, somewhat complicated. If you make a mistake, it’s tough to make it blend without it being too thick and once this is on there, it’s definitely on there...doesn’t smear. It will take some practice, but you get the hang of it. I’ve found if I do make a small mistake, I can use an eyebrow brush to blend it a bit better. I usually brush in the opposite direction and then the direction of my eyebrows and it helps a lot. But all in all, this is a good eyebrow pen and does help color in thin or spotty eyebrows.",Complete Brow Kit
584,5.0,Great stencils,Bought this for my mom and she absolutely loved the set of stencils. Definitely makes drawing in eyebrows less of a chore.,Complete Brow Kit
585,5.0,Long lasting and water proof,"I bought this for my wife soon as she saw it in Amazon. It lasts long and water-proof. The little problem is the color. We bought the color of chestnut since there's no lighter ones available (at that time). It turns out to be darker than what we thought. Another small thing is, she needs to learn how to draw with this pen to emulate natural ""brow look"".",Long Lasting Wear
586,3.0,Handy kit,Convenient and handy kit,Kit Completeness Accessories
587,3.0,Handy kit,Convenient and handy kit,Kit Completeness Accessories
588,1.0,No lo compres,"Mala calidad, no sirve, no funciona y se seca en cuestión de días",Value for Money
589,5.0,Super easy to use - long lasting wear,"I really like this product. You can easily build on to make it darker; however wait until the first coat dries before you build. I haven’t had any smudging problems, and it stays on really well!!",Long Lasting Wear
590,5.0,My wife loves it!,My wife loves it!,Value for Money
591,5.0,Error proof,The pen was easy to use and it stayed on all day.,Complete Brow Kit
592,5.0,Just what I needed,"This is the perfect color, a grayish brown, most eyebrow products are too warm. Also has the perfect consistency and lasts until you wash it off. Looks like I had my eyebrows microbladed!",Complete Brow Kit
593,5.0,I love it!,Easy to use and looks great!!,Complete Brow Kit
594,5.0,My favorite!!,It's easy to use and it's sweat proof!! This is going to be my go to product to use !!!!,Beginner Friendly Use
595,1.0,Not recommended,"There is barely any ink in this. Theoretically it's a great idea, design but the quality is crap. The color is off too. Waste of money, unfortunately.",Color Accuracy Concerns
596,5.0,Product gets the job done,I love this product ! Second time ordering it . It last soo long and you can sleep with it and wake up to it still on!,Long Lasting Wear
597,5.0,This brow pen gives my eyebrows life!,"I love that this eyebrow tattoo pen is the perfect color to match my brows (chestnut). Its moisture wicking feature keeps my brows from looking too wet. I'm not a makeup artist but this pen gives me the glamour look that I desire. The magic lies in the four soft fork tips. These fork tips give my eyebrows their natural hair-like appearance. I love that it's smudge-proof as I wear mine all day without having to reapply. The tattoo pen is lightweight, portable, and very easy to use. With its slim pencil-like style, I can easily fill in my brows to give them a thicker, fuller look. I am very pleased with not only the way this tattoo pen helps me to achieve an elegant, finished look each time I use it, but it also comes at a very affordable price. So, for the quality and the price, I will definitely continue to make future purchases of eyebrow tattoo pens by Music Flower.",Complete Brow Kit
598,5.0,Great product,Loved it!! Easy to use and stays on perfectly throughout the day! The 3 prongs give your brows a great shape! 10/10 recommend!,Complete Brow Kit
599,5.0,Easy Peasy to use,Easy to use; glides right on,Beginner Friendly Use
600,5.0,Best product!,This product is amazing! Will be buying again.,Product Drying Out
601,5.0,Staying Power,"I enjoy how easy the pen is to use and that it doesn't fade.  By the end of the day, it's still easy to wash off.  Just enough product goes on the skin to make the brows look very realistic.  I will likely be trying the black one next.",Complete Brow Kit
602,5.0,Fantastic product!,I ordered this product in two different colors and they both look great! The pen came with awesome tools to shape my brows. I bought one for my sister because I liked it so much!,Complete Brow Kit
603,5.0,Easy to use product,Easy to use and nice look when filling in the brows,Complete Brow Kit
604,5.0,Love it!!,"Great! I love it.  Super easy to use and last all day.. Very satisfied with this product, I'll order one more for mom and sister..👏👍",Beginner Friendly Use
605,5.0,Love the pen,I loved the pen and the materials it came with.  Nice packaging as well.  It is easy to use plus I love the fact it's not completely waterproof (as long as you try to take it off within a minute or so of application) in case you make a mistake.  Don't leave it on too long or you will have a hard time getting it off.<br />Overall 5 stars!,Complete Brow Kit
606,5.0,Easy brows,Great. Very easy to use  I have purchased this again,Complete Brow Kit
607,5.0,Works great!,Easy to use!,Beginner Friendly Use
608,5.0,Works great!,I had my eyebrows microshaded but they have faded a lot and look ashy now. They still have a good shape so this was so easy to use. Be careful and go gently or too much product will come out. I have a comparison picture of before and after if I can figure out how to add it.,Complete Brow Kit
609,5.0,Great product,"This is a great eyebrow pen, it works as expected and my eyebrows looks great with it. Would definitely recommend and would buy again.",Complete Brow Kit
610,4.0,Easy to use,"This product was very easy to use . As we age eyebrows can get sparse , but now we can freshen them back up.",Complete Brow Kit
611,1.0,Couldn’t use it. Totally dry.,Mine was completely dry. Couldn’t use it.,Product Dryness Issues
612,5.0,Great,Nice product. Will buy again .,Complete Brow Kit
613,5.0,Eyebrow application review,The pencil/ brush went on smooth and the eyebrow pattern was very helpful for application,Complete Brow Kit
614,5.0,Love it,Love it very easy to use.,Beginner Friendly Use
615,5.0,Can't beat the quality and price.,"This is super easy to use, dries quick and doesn't smudge. It is awesome for the price!",Beginner Friendly Use
616,5.0,Nice eyebrow pen,"I like the color and easy to use, looks very natural, good purchase!",Complete Brow Kit
617,4.0,Color is different than expected,The color was a bit different than expected. It has a lot of red tones to it.  Perhaps offer more shades,Color Accuracy Concerns
618,2.0,May be too small,"The ease of application is great but the micro blades are small so you cannot easily see the individual ""hair-like"" strokes.  I'm going to continue to look for a brand that is more suitable.  this one tends to apply like one stroke not individual hairs as depicted.",Application Difficulties
619,5.0,Great!!,Like,Value for Money
620,2.0,Didnt work for me,The item didn't work for me.  Didn't Hinges for my brow so I went back to using standard brow pencil,Complete Brow Kit
621,5.0,Satisfied with this product,This was exactly what I was looking for. Stays on until makeup comes off.,Complete Brow Kit
622,5.0,It works,Easy to use,Beginner Friendly Use
623,5.0,Great product !,Really like this brow pencil stays on till removed does not smudge will definitely buy again.,Complete Brow Kit
624,5.0,Waterproof,Love it!<br />I groom dogs and have had an issue keeping my makeup on when getting water splashed on me through out the day. This eyebrow pen stays on! It is the best!,Complete Brow Kit
625,5.0,Perfect Eyebrows,I’m so excited to receive this today! It’s an excellent product for an excellent price! It’s easy to use and stays on! Highly recommend!!,Complete Brow Kit
626,5.0,Easy to use.,Great product. Goes on well and looks nice. I will definitely buy this again!,Complete Brow Kit
627,5.0,Beginner friendly,This product is very easy to use and beginner friendly for those that don't have much experience with brows.  My brows look very full and natural after using this pencil.  I plan to order my mother one as well.,Beginner Friendly Use
628,1.0,Doesn't work after fist use,"Very expensive for something that only works once. The first time worked ok, after that you have to press so hard to get any product out onto the drawing points, the resulting effect is heavy and splodgy. Itried all the tip such as pressing it on paper first, which is fine, you get the intial''splodge''on the paper but then it still doesn't draw when you return to your eyebrows. Don't waste your money.",Complete Brow Kit
629,5.0,Super!,Long lasting and makes actual hair strokes. Doesn't drive out fast. Love! Just what I was looking for.,Complete Brow Kit
630,5.0,Highly recommend!,"The 4 point eyebrow pen is a great product.  It's easy to apply a little or a lot, and it stays in place really well. I'll definitely get it again.",Complete Brow Kit
631,5.0,Does not smudge & last all day,"Love it! Very easy to use, does not smudge, last all day and I like how it look real! Great product.",Complete Brow Kit
632,2.0,Cheap,Not worth it,Product Not As Described
633,5.0,The best kit I have used in a long time,"I got the product today tried it out took me a while to be light handed but got the hang of it. It is easy to use and love the little kit that it comes with. The color is great and stays on just like it said ,will be purchasing again",Complete Brow Kit
634,5.0,Excellente,Bello,Value for Money
635,5.0,Eye browns looking soooooo good,Love love love this product! Great quality and very fair price. Love that it comes as a kit. I’m new to adding any makeup to my eyebrows so all the stuff that comes with this order is just what I needed!,Complete Brow Kit
636,5.0,Great,works wonderful,Value for Money
637,5.0,Works wonders. ❤️❤️,Love this product ❤️❤️❤️,Product Drying Out
638,1.0,Don’t buy,Do not buy. Color says dark brown and it’s red.,Product Not As Described
639,5.0,A must have for blond brows!,"If you have blond, gray, or sparse brows this is a MUST HAVE for you!!  Easy to use and looks great!!!  HIGHLY RECOMMENDED!",Complete Brow Kit
640,5.0,How simple this is,I absolutely love this product!! It is easy and lasts ALL DAY!!!,Complete Brow Kit
641,5.0,Natural looking brows,Great for filling in sparse brows and grooming tools were a wonderful bonus.,Complete Brow Kit
642,5.0,Perfect deal,Pen was exactly what I expected and needed it was easy to use and smidge proof.,Kit Completeness Accessories
643,5.0,MY FAVORITE EYEBROW PEN #1!!!,"This is the second time that I ordered this pen, and I am so pleased. It became my favorite eyebrow pen ever, #1!!!",Complete Brow Kit
644,5.0,I love this brow pen!,"I've gone through several different ""tattoo"" eyebrow pens on Amazon.  This one is amazing!  It goes on easy and actually does look like hair strokes.  The others just looked like I use a marker on my brows.  This looks natural.  I bought the dark brown/chestnut color.  Matches my brows perfectly.",Complete Brow Kit
645,5.0,"Love this! Looks natural, does not smudge!","I was entirely impressed with this eyebrow pencil!! Not only did I get a pencil, but eyebrow stencils, NICE tweezers (pink yayyy) and an eyebrow trimmer (I think that’s what it’s for). It looks completely natural and does NOT smudge. I’m so glad I gave it a shot bc it makes me look more clean cut. Very nice. Totally recommend! Well worth it for the quality and price! (I used it very lightly, I easily would go on much darker)",Complete Brow Kit
646,3.0,disappointed,dark chocolate was as dark as I thought it would be. Does not come out has nicely has I like it too.,Product Drying Out
647,4.0,Definitely smudge proof.,I just received my brow pen. Super easy to use. The color was a great match. As far as the wear of the pen. I was able to wipe off the mistake I made quite easily with just water. So I don’t know how water proof it is. I will test and report back in a few days.  But it is smudge proof. Once it drys it doesn’t smudge which is awesome.,Complete Brow Kit
648,1.0,A flawless look,"Everything , not what I expected at all",Complete Brow Kit
649,5.0,Excited,It really works,Beginner Friendly Use
650,5.0,Really works,So far it's been awesome. First time trying it and looks like the real thing.,Value for Money
651,5.0,Best natural looking brow pen ever!,Best natural looking brow pen ever!,Complete Brow Kit
652,5.0,Love it!,"Love this product.  Easy to apply and it lasts all day, I will definitely be purchasing again.",Complete Brow Kit
653,5.0,Best eyebrow coverage,"easy to use, does not smudge and is waterproof.  Color is good match and natural looking,",Complete Brow Kit
654,5.0,This is a no-brainer! Super easy to use!,Product was so easy to use and I loved the eyebrow templates that came with it!,Complete Brow Kit
655,5.0,Works great!,"I bought it for my mom and she is so happy using this pen for her eyebrows, it looks natural, just what she wanted.",Complete Brow Kit
656,5.0,Great product!,Super easy to use and blend.,Beginner Friendly Use
657,5.0,Love love love !!!!,I’m not so good with eye brows but this pen and stencil makes me look like a pro it’s very easy to use and my brows came out perfect I got so many compliments I would def refer this out to anyone I love this product,Complete Brow Kit
658,4.0,Easy to use,It was easy to use and didn’t run off when I worked outside.,Beginner Friendly Use
659,5.0,Just as pictured!,Works just as described! Easy to use!,Beginner Friendly Use
660,1.0,Horrible,Worst I have ever used only 70° and still melted down my face,Complete Brow Kit
661,5.0,So excited,"So excited to test out this product. Didn't realize it came with extra goodies. Blade,tweezer,and stencils.",Included Bonus Tools
662,5.0,Great brow pencil,"Love it, so much better than a normal brow pencil!",Complete Brow Kit
663,3.0,Meh,Just ok.  Not nearly as easy to use as the Instagram video would lead one to believe.  Be forewarned that this company offers a $10 gift card in exchange for a 5-star review.  Not very ethical in my opinion.,Application Difficulties
664,5.0,Easy to use!,Easy to use!  The color was perfect!,Beginner Friendly Use
665,1.0,Don’t buy,Not worth your money do not buy,Product Not As Described
666,5.0,Extremely satisfied with my purchase,I loved that it’s not dried out like the ones i bought from other sellers,Product Drying Out
667,5.0,Pretty good product,I would have bought a darker color,Color Matching Issues
668,5.0,WORKS AS ADVERTISED,"THE EYE BROW  PEN WORKS GREAT WITH ARE WITHOUT THE BROW OUTLINERS THEY GIVE YOU, WILL BUY AGAIN",Complete Brow Kit
669,5.0,Very easy to use,"I love the way this goes on the eyebrow. Really, really smooth and easy.  Wonderful product!",Complete Brow Kit
670,2.0,This item is equivalent to a brown washable marker. Definitely not a eyebrow pencil!,This is a brown marker and not a magic marker either. Very easy to wipe away! Disappointed,Complete Brow Kit
671,1.0,Chesp,Didn’t go on right. Brush cheap,Complete Brow Kit
672,5.0,Great eyebrows,My eyebrows look so great! Product was easy to use.,Complete Brow Kit
673,5.0,Nice little kit,"I ordered this for my mother, but bought one for myself so I could see what it was all about. Honestly very pleased with it! I didn't even realize that it came with the razor, tweezers and eyebrow templates!  I'm very happy with this purchase!",Complete Brow Kit
674,5.0,Awesome,I like how my eyebrows look with this product.,Complete Brow Kit
675,3.0,Normal,Clear color,Color Accuracy Concerns
676,5.0,Great product. Easy to use. Won't hesitate to recommend,I received my microblading eyebrow pen today and used it immediately. It was easy to use and I could see a stark difference to my brows. They looked great.,Complete Brow Kit
677,5.0,It works!,Really is waterproof! I really like it!,Product Drying Out
678,5.0,Productos de belleza,"Excelente producto,  me encanto,  para mi gusto esta super bien.",Value for Money
679,5.0,Great purchase,Great product! Arrived on time and as is. Easy to use and great color.,Complete Brow Kit
680,3.0,Se seca pronto,Esta muy bien pero vino casi seco :-(,Application Difficulties
681,1.0,Did NOT work😕,Used it once and the next day nothing came out. Waste of time and over priced,Complete Brow Kit
682,5.0,Love this brow pen,Love the natural look of my brows.  Seems to be a terrific and cheaper alternative to brow tattooing.,Complete Brow Kit
683,2.0,Doesn't go on as advertised.,The product is not what I thought it should be. It doesn't stay on as long as it was advertised. It's to dark for me. I have blonde hair and I thought that chestnut would be lighter than that. Not worth the money I paid for it. Not happy with it at all.,Product Not As Described
684,5.0,Excellent,"Fast shipping, great packaging.  Love this product works great.",Complete Brow Kit
685,5.0,Great quality and price,Great product. And all the extra goodies that came with. Definetly recommend.,Kit Completeness Accessories
686,5.0,best eyebrow filler!,This product is amazing!! Stays on great once dried... fills in easily. Love it!,Complete Brow Kit
687,1.0,Doesn’t look good,Color didn’t match and the ink dried up really fast. Couldn’t get it to blend well. Strokes were to thick. Stick with an eyebrow pen.,Complete Brow Kit
688,2.0,Don’t buy!,Not a consistent liquid flow which makes dark and light spots!  Waste of money!,Product Not As Described
689,5.0,Excellent product,"Easy to use, looks great especially where my eyebrows are very thin or missing",Complete Brow Kit
690,5.0,Perfect color,Easy to use<br />perfect Color,Color Accuracy Concerns
691,3.0,Affordable,It’s okay I liked it when I first bought it but after a few uses it doesn’t really color in or shape like expected. It’s is a great price though. I’ve been storing it upside down so that when I use it next I get more of a flow. It does wash off easily with soap.,Beginner Friendly Use
692,5.0,Lines look real.,The first time I used this I was very impressed.  The brow lines look extremely natural.  I am very happy with this product.,Complete Brow Kit
693,5.0,Perfect color for,Great quality come with some extra stuff love it,Kit Completeness Accessories
694,5.0,Love it!!!!,"Great product, make my brows look natural!",Complete Brow Kit
695,5.0,Worth it!,Having overtweezted in my earlier years I needed to fill in some space between my brows and have made this a morning routine for years. This product is excellent and much more efficient and more natural looking than using fine brushes to draw single strokes and is definitely long lasting. I’ve tried other drugstore makeup products similar to this and this one beats them “hands down”. Worth the small price for more natural long lasting eyebrows.,Complete Brow Kit
696,5.0,Great product,This eye brow pen works great and super easy to use. Great product !,Complete Brow Kit
697,1.0,It barely had ink,Product seemed to be drying out,Product Drying Out
698,5.0,Easy to use,Item arrived quickly. Long lasting color.,Beginner Friendly Use
699,5.0,Great brow filler!,"This product filled in my eyebrows in a natural, not boxy way. Easy to use and lasted the whole day.",Complete Brow Kit
