Unnamed: 0,rating,title,text,topic
117,5.0,It works!  The color was on point,I got it the very next day after ordering and used it first thing this morning.  I host zoom meetings for my job so looking professional is a must.  I felt very confident after applying the brow pen and it looks absolutely natural.  I would recommend this to every gal trying to look her best!,Complete Brow Kit
118,5.0,Great product!,It was very easy to use and didn't smudge.  I really like this product.  I have tried many products and this one is straight forward and very easy to use and looks great on.  I feel confident that I have finally found a product that works well and does exactly what it claims.  Great product!,Complete Brow Kit
119,5.0,it is water proof,is 100 % water proof,Value for Money
120,5.0,Best Eyebrow Pen,"I have tried every eyebrow product on the market and  I would say this is the best one. The pen is easy to use for application, product does not smudge and looks natural. I plan to buy it again.",Complete Brow Kit
121,5.0,Recommend 💯,Love this product!<br />It’s so easy to use; doesn’t take much time to make your eyebrows perfect 👌🏻 And it DOESN’T  look like you drew them on your face! Natural look!<br />Love the fact it doesn’t just disappear off your face when you sweat.,Complete Brow Kit
122,5.0,Easy to use,This is amazing.  My eyebrows look great and stays on all day.  It also comes with a kit which makes it easier if you want a different shape brows. I got the  dark brown and it fits great for my fair skin.,Complete Brow Kit
123,5.0,Yes! I will buy it again!,Love this! Great bang for the buck!<br /><br />Easy to use! Zero smudge! Long lasting. Will absolutely order again!,Complete Brow Kit
124,5.0,Worth the hype!,Very easy to use best eyebrow product I have found,Complete Brow Kit
125,5.0,Perfect for a natural look!,I can’t get over how amazing this eyebrow pen is especially for someone like who can’t get the shape of my eyebrows to look natural and is far from being a pro! I needed a pen that is quick and easy (especially with the pronged tip) in my day to day schedule and gives me the long lasting natural look to get me through my day despite my oily skin. This is a must add to your makeup routine.,Complete Brow Kit
126,5.0,I love this product.,Great price and it’s great that it comes with all the tools needed to make my eyebrows look great. Thank you.,Complete Brow Kit
127,5.0,Full eyebrows again.,"This pen works great to fill in my patchy eyebrows. It takes a little practice to get the strokes correct, but looks great once completed. My eyebrows stay on all day.",Complete Brow Kit
128,5.0,Perfect.Perfecto !!,"I loved ,perfect !! .Me encanta es perfecto ,es la 4 vez que lo compro .Lo recomiendo mucho !!!.Dura todo el dia sin correrse!!",Value for Money
129,5.0,How easy it is to use and how natural it looks.,It is so easy to use and the color was perfect.,Beginner Friendly Use
130,5.0,Lasts all day,Lasted all day!,Long Lasting Wear
131,5.0,Easy and realistic,"I like the natural look when I finish. My husband even said, “ you look very nice!”<br />I didn’t say why.",Complete Brow Kit
132,1.0,Not to happy,Not the right color for my eyebrows and the wicks were drying out,Product Drying Out
133,1.0,Not what it advertised it to be,Not as advertised. Barely marks. It says it can draw hairlike lines. Not really,Product Not As Described
134,5.0,Eyebrows look natural,"I really like this product. The ease of application, and the brown color is perfect with my hair. It does not look like fake brows. It dried quickly on the brow. I would recommend this for a nicely shaped brow. No mess and simple.",Complete Brow Kit
135,5.0,Awesome product,Love it,Complete Brow Kit
136,3.0,"Pencil works, just not the look I'd hoped for","I will use this product, since I ordered it, but, like any eyebrow pencil I've used in the past, it doesn't look natural, it clumps up, & the color doesn't match my own. The  little tips make a nice ""hair line"" look, but only in the areas where I can angle it correctly. On the arch of my brow, where I need it the most, it's hard to get a good angle & it looks gloppy. On the positive side, it is water & smudge-proof, as advertised, & it comes off easily with make-up remover. The pencil itself works, it's just not the look I'd hoped for.",Color Accuracy Concerns
137,5.0,Facil de Usar,Me encanto el producto,Value for Money
138,5.0,Best eyebrow product,This is THE only eyebrow product you will<br />Need!,Complete Brow Kit
139,5.0,Easy. Looks great. Makes me look fine!,I love the fact it appears to actually be eyebrows and not a swipe of color. Great prod t!,Complete Brow Kit
140,5.0,Love this product,"Finally, a great eyebrowpen that looks natural and it's waterproof!!!",Complete Brow Kit
141,5.0,Looks so natural!,Easy to apply and looks so much more natural than the single eyebrow pencils.<br />Great price and great product.  Thanks so much!,Complete Brow Kit
142,5.0,👍🏽,Works and looks amazing,Complete Brow Kit
143,5.0,Great deal!,"Great deal especially for the price! It comes with 3 different outline shapers for your brows and a blade for shaping as well. The eye brow pencil itsself was very easy to use, looks very natural and it stayed on all day without smudging. I love how the three prongs make it look just like your brows! Would highly recommend.",Complete Brow Kit
144,5.0,Love it,This little brush makes my brokers look amazing natural look💕,Complete Brow Kit
145,5.0,Love it! Buy it! Can't lose.,The first minute while it's drying it looks a bit wet and marker-y and after that it dries to a very natural finish for me. I had to look hard to discern what was my real hair and what I had added in.,Complete Brow Kit
146,5.0,😊,Perfect,Value for Money
147,5.0,Love it!,First time using an eyebrow pen like this! Love the hair-like strokes!,Complete Brow Kit
148,5.0,Nice pronged eyebrow pen,"I was looking for a pronged, smudge proof eyebrow pen with a small tip, that was reasonably priced. Previously used Lottie London which is no longer available at Target. So far this pen has delivered. Pen came with an eyebrow razor and three eyebrow stencils which was unexpected but a nice perk.",Complete Brow Kit
149,5.0,Smudge free and affordable,Great and affordable eyebrow pen that’s smudge proof. I had to reallyyy rub my eyebrows to get it to budge but with a little makeup remover it’s easy to remove. Perfect for all day long wear :),Complete Brow Kit
150,1.0,Pure Crap!,The tweezers were missing. Color was very off like bright red! Ran out after one eyebrow vendor did not respond to me.,Complete Brow Kit
151,5.0,Great brow pen!,I use this pen every day to freshen up my micro blading. It is like a tattoo!,Complete Brow Kit
152,2.0,Wish is wasn’t dried out,Ink was try,Product Drying Out
153,3.0,So-so,"Better than a pencil, but don’t feel it’s worth the price",Color Accuracy Concerns
154,5.0,It’s awesome,"It does everything it says it does, and has cut my eyebrow coloring routine time by half.",Complete Brow Kit
155,5.0,works great,very good,Value for Money
156,1.0,Ehh,I had high hopes as this Product had pretty good reviews. When I use it I found it to be kind of sloppy when it actually worked most of the time it felt like the application tip was dry and not making any kind of Mark.,Product Dryness Issues
157,5.0,Fun affordable,Perfect Gave Me Just What I Was looking For !!!!! I am So Happy With it My look is complete and its so easy to use !!😍😍,Complete Brow Kit
158,5.0,Definitely worth buying it!,"Great product! Works just like advertised, goes on smoothly, easy to apply and stays  on until removing with makeup wipes.<br />It looks very natural and I got quite a few compliments lately:-)",Complete Brow Kit
159,5.0,Great product!,Quick learning curve. Fast and easy to use. Lasts all day. End results meet expectations. Would buy again and try a different color.,Beginner Friendly Use
160,5.0,Perfect Brow Pencil,It's smudge-proof.,Complete Brow Kit
161,5.0,Great product,This product is amazing.. I use to pluck my eye brow all the time and in doing so they dont grow back in anymore so this is definitely a game changer.. Will definitely get it again,Complete Brow Kit
162,5.0,Great product.,I’m very please with my Eyebrow pen microblade. It is easy to use and does not smear. I would highly recommend it.,Complete Brow Kit
163,1.0,Unnatural & Harsh Color,"Sadly, the color (dk brown) is still is off, with a reddish tint. Also, unnatural strokes. Yes, there’s a learning curve, but I still feel the product coloring is too harsh & unnatural. I’ll hang onto it, mainly to avoid the return hassle for such a small item. Would not recommend if your brows are sparse or brown, blonde or in between.",Color Accuracy Concerns
164,5.0,Looks great!,Easy to use for even those who are inexperienced,Beginner Friendly Use
165,5.0,Good applicator,really good tool to add dimension and pseudo volume,Included Bonus Tools
166,1.0,Dried out fast,Dried out after a few days even though I kept it upright when stored. Bought the bowbeen tattoo brow pen and it has been working much better and has an extra tattoo prong,Product Drying Out
167,5.0,Easy to use,"The pen was easy to use and that says alot for me, because I'm new to wearing makeup and had no issues. It does what it describes.",Beginner Friendly Use
168,5.0,Love this for my eyebrows!,This is my second time purchasing. Helps fill in fading eyebrow color. Very easy to use and natural looking. Thank you!,Complete Brow Kit
169,5.0,Love!,Easy to use kit! Eyebrows do not come off during the day! Love!!!,Complete Brow Kit
170,5.0,Absolutely wonderful product,"This eyebrow pen is so great! it not only filled in my thinning brows, it looks like professional microblading. It is long-lasting and a good shade. Eyes are so important now with masks covering half your face. This pen helps your eyebrows look their best. Definitely recommend!",Complete Brow Kit
171,5.0,good,Good,Value for Money
172,2.0,Shopper Disappointed,it dried up after only 2 uses. I wish the liquid would last longer. Concept is good but quality of the product is not.,Product Drying Out
173,3.0,Great concept but dried out quickly,Loved the product the first couple days using but the pen dried out within a week...,Product Drying Out
174,5.0,Good product,Good product. A little lighter than I expected but good all in all.,Kit Completeness Accessories
175,5.0,really love this!!,exactly as described and i love the extra eyebrow shapers provided. Item work really well.,Complete Brow Kit
176,5.0,Great natural- looking brows!,I like this product because it’s easy to use. The three “prong” tip makes the eyebrows look more natural!,Complete Brow Kit
177,1.0,No fine lines,This does no better than a regular eyebrow pencil. In fact I think its possibly worse.,Complete Brow Kit
178,2.0,fine lines,"The ability to create just ""fine"" lines.  Just couldn't get that effect.  the lines were not lash size and seemed to glob.  didn't have any problem removing, it just wiped off.  Needs to have ""finer"" applicator to achieve the eyebrow look.",Complete Brow Kit
179,5.0,Awesome,Love it,Value for Money
180,5.0,"Like this product, ilikeitalot!!","First time ive used an eyebrow pen, pencil. I like the product. Easy to use!",Complete Brow Kit
181,5.0,Worth it!,"I love it, good quality. Definitely buying it again.",Value for Money
182,3.0,Doesn’t last.,Dried up very quickly after only a few uses.,Product Drying Out
183,5.0,So cute!,It looks so natural I love how this product came! Definitely buying it again! ❤,Complete Brow Kit
184,5.0,GET IT NOW,"I absolutely LOVE this product. Since it’s summer with it being hot and being in the water, my other brow product I was using smudged so much. This product doesn’t smudge at all! Even after washing my face the product still stayed on (which I loved because I hate my brows). When you first put it on it seemed wet just because of the product but it dried fast and looked super natural. I’m so happy with this product!",Complete Brow Kit
185,5.0,Amazing,First time trying this product and I love it. It’s amazing.,Beginner Friendly Use
186,5.0,Perfect!,Amazing! Its great and just what I was looking for!!,Value for Money
187,1.0,Disappointed,It was completely dried up. I never got to use it. I sure was disappointed.,Product Drying Out
188,5.0,Perfect brows!,Fast delivery and great product. My eyebrows look absolutely perfect!,Complete Brow Kit
189,5.0,Worked well and didn’t smudge!,"I bought this as a less expensive alternative to a product I learned about from a blogger I follow. I was immediately impressed with how easily it worked. I am not an expert when it comes to applying makeup, but this added just the right textured look I was hoping for and went on easily the first time I tried it. It didn’t smudge and lasted the whole day! I definitely recommend it!",Complete Brow Kit
190,5.0,GREAT PRODUCT,"GLIDES ON GREAT, STAYS ON ALL DAY AND WILL BUY AGAIN.",Long Lasting Wear
191,5.0,Easy to use and it dries really fast.,I like that it dries super fast and it's easy to use not only that but it's not messy.  You might see a little product if you do the smudge test with some hard staring though 4.5 ⭐for the smudge.,Product Dryness Issues
192,5.0,Quaility brow pencil,I love this!,Complete Brow Kit
193,5.0,The product works and is easy to use,I used this product  to blend in my brows for a fuller look,Complete Brow Kit
194,5.0,"Buy it, it’s worth it.","Great product, color was spot on. Used it for the first time after I had my eyebrows waxed and it made them look soo good. I highly recommend. 5 stars.",Complete Brow Kit
195,5.0,Great product.,"Product is easy to use and really stays on, even thru workouts and the rain.",Product Drying Out
196,5.0,Tattoo eyebrow pen works well.,I love it. I use it for my eyebrows and it stays on well. I will b ordering more soon.,Complete Brow Kit
197,5.0,Good product,"A little hard to use at first, but then I got the hang of it.",Beginner Friendly Use
198,5.0,great product,"Its very easy to apply, I love the stencils so you can gage your blading, shading and shaping. I will continue buying this product!",Complete Brow Kit
199,5.0,"Awesome product, fast shipping",I love the ease of use and the color!,Beginner Friendly Use
200,5.0,My favorite,Love it so easy to use,Beginner Friendly Use
201,5.0,It looks great!,I liked the product because was easy to use. It looks natural and stays on very well. I will purchase it again and will recommend it to others.,Complete Brow Kit
202,1.0,Hardly  able to see,"I did not like this product at all.  It barely makes any marks on my eyebrow.  I ordered dark brown and when I use it I can barely see anything.  So unfortunately, I do not use it.",Complete Brow Kit
203,5.0,Will buy again,"I have seen this product in a social media and was curious about how it might be used and it turned out it is easy to use and the result is better than what I had before. I will buy black color next time though, my hair is black . Lol.",Complete Brow Kit
204,5.0,Great product,Was very easy to put on lines came out great.,Complete Brow Kit
205,5.0,The best product out there,This was the best purchase I have made. I bought it for my daughter’s birthday and she loves how manageable it was to control. It lasts long and doesn’t smear.,Complete Brow Kit
206,5.0,Smear no more.,I love this product. It covered the gray in my brows perfectly. The fork shape fills in the bare spots seamlessly.  The color is perfect.  It  did not smear.  I would buy it again.,Complete Brow Kit
207,5.0,Precise!,Color very good- pen is precise and gives good film of brows.  Easy to use and smudge proof .  Have been using one month and it has not run out yet.  Would recommend!,Complete Brow Kit
208,5.0,It lasts and doesn't smudge.,"I wish you would offer a taupe shade. My formerly auburn hair is now silver and the dark brown is a bit too dark, the gray too black.",Long Lasting Wear
209,1.0,Application,Doesn't work well.,Application Difficulties
210,5.0,good,liked,Value for Money
211,5.0,Smooth application,Works just like what I bought for $30 at Ulta. I'm brunette and the chestnut is a perfect match.,Complete Brow Kit
212,4.0,Be careful not to go to dark if you have light hair,Very easy to apply,Complete Brow Kit
213,5.0,Great product,Product worked better than expected! I’ve read reviews on many eyebrow pens like this on amazon and Sephora and this one had the best reviews so I went with this one. Glad I did. Product applies smoothly and stays put!,Complete Brow Kit
214,5.0,Smudge proof and long lasting.,"Love this eyebrow pencil! Comes with eyebrow stencils, so easy to use and long lasting. Will definitely buy and use again.",Complete Brow Kit
215,5.0,Perfect to add to my routine,"Easy to use, has great angle for making realistic strokes.",Beginner Friendly Use
216,5.0,Amazing!,Absolutely love this product! I’m sold and will continue to buy!!! ❤️,Product Dryness Issues
217,1.0,Not waterproof or smudge proof during workouts,"I gave a rating of one star for MOISTURE WICKING and SMUDGE PROOF because it listed as waterproof and perfect for wearing to workout and would not smudge or run even with sweatiest workouts. It is not waterproof, it does not stay during heavy sweaty workouts nor light sweat workouts. It is great if you wear it during the day and/or night that don’t involve intense or moderate gym workouts. I wear it outside of the gym but have to add a darker shade of brown eyebrow powder over the eyebrow pen because the color is a reddish brown and I am a dark brown.",Product Dryness Issues
218,5.0,AWESOME!,Very good purchase i would definitely recommend. Very easy to use and definitely worth the buy! thanks!,Beginner Friendly Use
219,5.0,nice product,Great product. I had  my microbladed eyebrows touched up and she used a different color which was a disaster. I bought this item to help until I can get them fixed. Love the color (chestnut) easy to use and lasts. I will buy this item again,Complete Brow Kit
220,5.0,Good product,Works really well!,Product Drying Out
221,5.0,Superior product!,"LOVE this product. I’ve tried at least 10 different brow pencils/pens and none have worked for one reason (or more) in most cases. Appreciate they include tweezers, razor and shape guides. Will 100% buy again.",Complete Brow Kit
222,5.0,Keep doing the best product,I like this product is easy to use and stay longer in it,Product Drying Out
223,5.0,My favorite!!,"I absolutely love this product, true to what it says,I get so many compliments ❤😊",Complete Brow Kit
224,1.0,The color wasn’t right and didn’t work good,It’s. Wasn’t good like people said and a waste of $10 didn’t even work good,Color Matching Issues
225,5.0,Very Nice.,As soon as I received my package I had to try it. It was very easy to use and I find it to be smudge-proof. I really like it.,Complete Brow Kit
226,1.0,This produce does not flow out of the pen well at all and looks very fake on,"This produce does not flow out of the pen well at all and looks very fake on.  I've only had it for a couple of weeks and now i cant get anything out of the pen, its either empty or just dried up.  Do not waste your money!",Product Drying Out
227,5.0,I’m so new!,I’m soooo new to the eyebrow world and this kit def makes it easier.. love how it includes stencils!!,Complete Brow Kit
228,5.0,Looks just like micro blading,"Best eyebrow makeup ever!! Does not smudge, looks like you’re not even wearing makeup. The dark grey color is perfect for my dark brown eyebrows.",Complete Brow Kit
229,1.0,Honest review,The lines weren’t consistent when you try to stroke them on your eyebrow. Then it would smudge and disappear.,Complete Brow Kit
230,5.0,Perfect drawn eyebrows!!!,Purchased the Chestnut and it was a perfect match!!  Love how it glides on. I hardly have any eyebrows but after using this pen you would not have known!!  Also love the cute pink tweezers and shaver!!  Highly recommend this product!,Complete Brow Kit
231,1.0,Sorry..,It's a cheap marker.,Product Not As Described
232,1.0,This was a horrible product! It was dried out .  this is the first bad review I have ever written …,"Was horrible… dried out did not work would not recommend this product. It was inexpensive, so I guess get what you pay for . I still have package I may just send it back . Two thumbs down….",Product Drying Out
233,5.0,Great brow pen,"Excellent brow pen. I was able to add natural looking thickness to my brows using this product easily. It comes with tweezers, razor, and brow stencil but I honestly haven't used them. I'm just using the brow pen alone and love my results.",Complete Brow Kit
234,5.0,"Easy to use, reliable product",I love this microblading eyebrow pen; easy to use and looks natural :),Complete Brow Kit
235,5.0,So easy to use and no smudging!,So easy to draw a perfect eyebrow that I wanted.,Complete Brow Kit
236,5.0,Great product for the price,Works great!,Value for Money
237,5.0,Great Product,This is a great product.  It does exactly what it says it does.  Gives natural looking definition and goes on very easily.,Complete Brow Kit
238,5.0,Very good!,"It is a very good product, I will recommend!",Value for Money
239,5.0,Su versatilidad.,"En vez de usar lapices para las cejas,  lo uso para acentuar el tono y la forma de las mias. Muy facil de usar y sobre todo muy natural!",Complete Brow Kit
240,5.0,Fantastic!,"I really like this product. There is a learning curve to applying it but once you get the hang of it it’s great. The color is right on and it lasts! Don’t be too heavy handed, light strokes go a long way to keeping the color even and not splotchy. I’m between a medium brown and dark brown. I usually go for a darker brown because often a lighter brown takes a reddish tone on me. The chestnut is perfect for me!",Complete Brow Kit
241,5.0,Great product!,This is a great buy! Love the way it makes my eyebrows look!,Complete Brow Kit
242,5.0,Very durable,Easy to apply.,Long Lasting Wear
243,5.0,Easy to use A++,Easy to use A++,Beginner Friendly Use
244,5.0,love it,Easy to use. Good!,Beginner Friendly Use
245,5.0,Great product,Great product! I would rebuy it again and definitely recommend it !,Complete Brow Kit
246,2.0,Not very easy to put on,It’s ok. Not near as easy to put on as it’s made to look,Application Difficulties
247,5.0,Great product!,It’s great product. It also shipped quickly.,Complete Brow Kit
248,3.0,In theory a great product...,"I bought this on a lightning deal and thought, hey why not?<br /><br />Item came quick and packaging was nice. In addition to the pen there was a few stencils and an eyebrow shaver. All I've used so far is the pen so ill rate on just that.<br /><br />1. Color. I chose chestnut thinking it would be okay. Nope. I shoulda went darker. You can tell the difference in the last photo where I am wearing glasses. Go darker ladies!<br /><br />2. Pen application. Definitely easy to apply and correct if you make a mistake. A lot faster as well since there are three points.<br /><br />3. Waterproof. Nope. The first pic of my eyebrows was before a shower. The second is after the shower and no trace of the pen can be found.<br /><br />Overall - I'd still get it if they fixed the ""waterproof"" issue. Otherwise, be sure to check the color. My previous pens were always a ""dark brown"" and I thought this would be the same.",Color Accuracy Concerns
249,5.0,Easy to use!,Very natural looking<br />I feel like I have eyebrows again,Complete Brow Kit
250,5.0,Great product!,I actually  really like this! It works great. And super easy to use! And that says alot coming from me lol,Beginner Friendly Use
251,4.0,Gracias amazon su calidad es muy buena,Muy bueno la pinta muy bien,Value for Money
252,5.0,Best Thing Ever,I love this eyebrow pen. I was going to get microblading.  After the cost and horror stories. I tried this pen. Used before the gym and in the pool. It did not smudge. I will be buying more of them. Im happy the reviews I read were actually true. Great product,Complete Brow Kit
253,5.0,Great buy!,I bought this product for my wife. She loves how long it last and how natural it looks. Great buy!,Complete Brow Kit
254,2.0,Good for 1 use,This lasted for 1 use and dried out immediately. The only reason it got 2 stars is because of the longevity,Product Drying Out
255,5.0,Great product!!,"Great product, lots of extras!",Kit Completeness Accessories
256,3.0,Strange color,"I like how easy this is to use and the fact that it stays on until you wash it off.  I do not like the color, I would describe it as red, not brown.",Color Accuracy Concerns
257,5.0,Great!,I love the way it goes on.. Stays on without smudging!,Complete Brow Kit
258,1.0,Application iffy and difficult,"Ink does not flow very well and when shaken to move liquid down, splatters everywhere",Application Difficulties
259,5.0,Awesome product for price!,This is the best product! Love how easy it goes on and color matched up perfect! Can wear all day long without smudging!  Will definitely buy again! ❤️,Complete Brow Kit
260,5.0,Finally found it!,I have been looking for quite a long time to find a product that I could use like this one. It is exactly what I have wanted. It is easy to apply and fills in without my brows looking fake.  A light touch to the skin is all it needs. It is also easy to remove in the evening.  The tube size is also easier to handle than a very thin one.,Complete Brow Kit
261,5.0,Good quality,Great product,Value for Money
262,5.0,Eyebrows pen,This goes on easy and looks great. I love it.,Complete Brow Kit
263,5.0,Easy to use and last long all day!,"It’s very easy to use, it last long for the day. Even after my sweaty workout!",Long Lasting Wear
